{"$id":"https://in-the-loop.local/schemas/kg-rag/kg-rag-blueprint.schema.json","$schema":"https://json-schema.org/draft/2020-12/schema","additionalProperties":false,"properties":{"adapters":{"additionalProperties":false,"properties":{"answerer":{"additionalProperties":false,"properties":{"implementation":{"type":"string"},"kind":{"type":"string"},"network_enabled":{"type":"boolean"}},"required":["kind","implementation","network_enabled"],"type":"object"},"embedder":{"additionalProperties":false,"properties":{"implementation":{"type":"string"},"kind":{"type":"string"},"network_enabled":{"type":"boolean"}},"required":["kind","implementation","network_enabled"],"type":"object"},"graph_store":{"additionalProperties":false,"properties":{"implementation":{"type":"string"},"kind":{"type":"string"},"network_enabled":{"type":"boolean"}},"required":["kind","implementation","network_enabled"],"type":"object"},"lexical_index":{"additionalProperties":false,"properties":{"implementation":{"type":"string"},"kind":{"type":"string"},"network_enabled":{"type":"boolean"}},"required":["kind","implementation","network_enabled"],"type":"object"},"observability":{"additionalProperties":false,"properties":{"implementation":{"type":"string"},"kind":{"type":"string"},"network_enabled":{"type":"boolean"}},"required":["kind","implementation","network_enabled"],"type":"object"},"reranker":{"additionalProperties":false,"properties":{"implementation":{"type":"string"},"kind":{"type":"string"},"network_enabled":{"type":"boolean"}},"required":["kind","implementation","network_enabled"],"type":"object"},"vector_index":{"additionalProperties":false,"properties":{"implementation":{"type":"string"},"kind":{"type":"string"},"network_enabled":{"type":"boolean"}},"required":["kind","implementation","network_enabled"],"type":"object"}},"required":["graph_store","vector_index","lexical_index","embedder","reranker","answerer","observability"],"type":"object"},"blueprint_id":{"type":"string"},"corpus":{"additionalProperties":false,"properties":{"contradiction_policy":{"type":"string"},"deletion_policy":{"type":"string"},"entity_resolution_policy":{"type":"string"},"extraction_policy":{"type":"string"},"freshness_policy":{"type":"string"},"ontology":{"additionalProperties":false,"properties":{"bytes":{"type":"integer"},"path":{"type":"string"},"sha256":{"type":"string"},"version":{"type":"string"}},"required":["path","bytes","sha256","version"],"type":"object"},"provenance_policy":{"type":"string"},"reindex_policy":{"type":"string"},"shapes":{"additionalProperties":false,"properties":{"bytes":{"type":"integer"},"path":{"type":"string"},"sha256":{"type":"string"},"version":{"type":"string"}},"required":["path","bytes","sha256","version"],"type":"object"},"source_ids":{"items":{"type":"string"},"type":"array"}},"required":["source_ids","ontology","shapes","extraction_policy","entity_resolution_policy","contradiction_policy","provenance_policy","freshness_policy","deletion_policy","reindex_policy"],"type":"object"},"evaluation":{"additionalProperties":false,"properties":{"adversarial_cases":{"items":{"additionalProperties":false,"properties":{"expected":{"type":"string"},"id":{"type":"string"}},"required":["id","expected"],"type":"object"},"type":"array"},"baseline":{"type":"string"},"criteria":{"items":{"anyOf":[{"additionalProperties":false,"properties":{"aggregation":{"type":"string"},"direction":{"type":"string"},"evidence_status":{"type":"string"},"metric_id":{"type":"string"},"minimum_samples":{"type":"integer"},"population":{"type":"string"},"rationale":{"type":"string"},"threshold":{"type":"integer"},"tolerance":{"type":"number"}},"required":["metric_id","population","aggregation","direction","threshold","rationale","minimum_samples","tolerance","evidence_status"],"type":"object"},{"additionalProperties":false,"properties":{"aggregation":{"type":"string"},"direction":{"type":"string"},"evidence_status":{"type":"string"},"metric_id":{"type":"string"},"minimum_samples":{"type":"integer"},"population":{"type":"string"},"rationale":{"type":"string"},"threshold":{"type":"number"},"tolerance":{"type":"number"}},"required":["metric_id","population","aggregation","direction","threshold","rationale","minimum_samples","tolerance","evidence_status"],"type":"object"}]},"type":"array"},"result_vocabulary":{"items":{"type":"string"},"type":"array"},"thresholds_are_universal":{"type":"boolean"}},"required":["baseline","criteria","adversarial_cases","result_vocabulary","thresholds_are_universal"],"type":"object"},"framework_id":{"type":"string"},"governance_session":{"additionalProperties":false,"properties":{"budgets":{"additionalProperties":false,"properties":{"compute_units":{"type":"integer"},"cost_observability":{"type":"string"},"latency_ms":{"type":"integer"}},"required":["latency_ms","compute_units","cost_observability"],"type":"object"},"consent_verified":{"type":"boolean"},"intent":{"type":"string"},"licenses_verified":{"type":"boolean"},"network_allowed":{"type":"boolean"},"privacy_class":{"type":"string"},"private_content_excluded":{"type":"boolean"},"recovery_restores_authority":{"type":"boolean"},"retention":{"additionalProperties":false,"properties":{"days":{"type":"integer"},"mode":{"type":"string"}},"required":["mode","days"],"type":"object"},"secrets_excluded":{"type":"boolean"}},"required":["intent","privacy_class","licenses_verified","consent_verified","secrets_excluded","private_content_excluded","network_allowed","recovery_restores_authority","retention","budgets"],"type":"object"},"profile":{"type":"string"},"qualification_scope":{"type":"string"},"retrieval":{"additionalProperties":false,"properties":{"abstention":{"type":"string"},"citations_required":{"type":"boolean"},"context_budget":{"type":"integer"},"evidence_packet_required":{"type":"boolean"},"fallback":{"type":"string"},"fusion":{"additionalProperties":false,"properties":{"method":{"type":"string"},"tie_break":{"type":"string"}},"required":["method","tie_break"],"type":"object"},"query_routes":{"items":{"additionalProperties":false,"properties":{"query_class":{"type":"string"},"route":{"type":"string"}},"required":["query_class","route"],"type":"object"},"type":"array"},"reranking":{"additionalProperties":false,"properties":{"enabled":{"type":"boolean"},"policy":{"type":"string"}},"required":["enabled","policy"],"type":"object"},"route":{"type":"string"},"traversal":{"additionalProperties":false,"properties":{"direction":{"type":"string"},"maximum_candidates":{"type":"integer"},"maximum_depth":{"type":"integer"}},"required":["direction","maximum_depth","maximum_candidates"],"type":"object"}},"required":["route","query_routes","traversal","fusion","reranking","context_budget","fallback","abstention","evidence_packet_required","citations_required"],"type":"object"},"schema":{"type":"string"},"selected_recipes":{"items":{"type":"string"},"type":"array"}},"required":["schema","blueprint_id","framework_id","profile","qualification_scope","selected_recipes","governance_session","corpus","retrieval","adapters","evaluation"],"title":"kg-rag-blueprint","type":"object"}
