{"adapters":{"answerer":{"implementation":"abstract","kind":"answerer","network_enabled":false},"embedder":{"implementation":"abstract","kind":"embedder","network_enabled":false},"graph_store":{"implementation":"abstract","kind":"graph_store","network_enabled":false},"lexical_index":{"implementation":"abstract","kind":"lexical_index","network_enabled":false},"observability":{"implementation":"abstract","kind":"observability","network_enabled":false},"reranker":{"implementation":"abstract","kind":"reranker","network_enabled":false},"vector_index":{"implementation":"abstract","kind":"vector_index","network_enabled":false}},"blueprint_id":"call-e","corpus":{"contradiction_policy":"preserve-both-sides-with-lineage","deletion_policy":"tombstone-delete-derived-artifacts-and-reindex","entity_resolution_policy":"preserve-unresolved-and-conflicting-identities","extraction_policy":"bounded-and-source-addressable","freshness_policy":"revalidate-pinned-snapshot-before-use","ontology":{"bytes":350,"path":"kg-rag/ontology-plan.json","sha256":"f06c147bf64d7bd8eb329aa43d37186f13bb8c1e59ecba661527c85cde00bb9e","version":"0.1.0"},"provenance_policy":"preserve-record-to-claim-transformation-paths-and-reject-derivation-cycles","reindex_policy":"deterministic-rebuild-after-update-or-deletion","shapes":{"bytes":229,"path":"kg-rag/shapes-plan.json","sha256":"d6eb479ef980c44703deeabea99221dfb7fc399073fdc56baecb2050f20380d0","version":"0.1.0"},"source_ids":["itl-terminology-177","rdf-1.2-concepts","shacl","prov-o","json-ld-1.1","rag-v4","microsoft-graphrag","nist-ai-rmf-1.0","otel-semconv-1.40.0","call-e-authoritative-brief"]},"evaluation":{"adversarial_cases":[{"expected":"refuse-or-preserve-boundary","id":"retrieved-instruction-injection"},{"expected":"refuse-or-preserve-boundary","id":"source-impersonation"},{"expected":"refuse-or-preserve-boundary","id":"entity-collision"},{"expected":"refuse-or-preserve-boundary","id":"contradiction-and-staleness"},{"expected":"refuse-or-preserve-boundary","id":"deletion-followed-by-retrieval"},{"expected":"refuse-or-preserve-boundary","id":"adapter-capability-mismatch"},{"expected":"refuse-or-preserve-boundary","id":"secret-or-private-content-request"},{"expected":"refuse-or-preserve-boundary","id":"protected-effect-request"}],"baseline":"offline-lexical-baseline","criteria":[{"aggregation":"macro-average","direction":"gte","evidence_status":"not_observed","metric_id":"retrieval-recall","minimum_samples":1,"population":"project-fixtures-retrieval-recall","rationale":"project-specific predeclared acceptance boundary for retrieval-recall","threshold":0.55,"tolerance":0.0},{"aggregation":"macro-average","direction":"gte","evidence_status":"not_observed","metric_id":"retrieval-precision","minimum_samples":1,"population":"project-fixtures-retrieval-precision","rationale":"project-specific predeclared acceptance boundary for retrieval-precision","threshold":0.6,"tolerance":0.0},{"aggregation":"macro-average","direction":"gte","evidence_status":"not_observed","metric_id":"ranking","minimum_samples":1,"population":"project-fixtures-ranking","rationale":"project-specific predeclared acceptance boundary for ranking","threshold":0.65,"tolerance":0.0},{"aggregation":"macro-average","direction":"gte","evidence_status":"not_observed","metric_id":"entity-resolution","minimum_samples":1,"population":"project-fixtures-entity-resolution","rationale":"project-specific predeclared acceptance boundary for entity-resolution","threshold":0.7,"tolerance":0.0},{"aggregation":"macro-average","direction":"gte","evidence_status":"not_observed","metric_id":"triple-path-validity","minimum_samples":1,"population":"project-fixtures-triple-path-validity","rationale":"project-specific predeclared acceptance boundary for triple-path-validity","threshold":0.55,"tolerance":0.0},{"aggregation":"macro-average","direction":"gte","evidence_status":"not_observed","metric_id":"citation-precision","minimum_samples":1,"population":"project-fixtures-citation-precision","rationale":"project-specific predeclared acceptance boundary for citation-precision","threshold":0.6,"tolerance":0.0},{"aggregation":"macro-average","direction":"gte","evidence_status":"not_observed","metric_id":"citation-coverage","minimum_samples":1,"population":"project-fixtures-citation-coverage","rationale":"project-specific predeclared acceptance boundary for citation-coverage","threshold":0.65,"tolerance":0.0},{"aggregation":"macro-average","direction":"gte","evidence_status":"not_observed","metric_id":"factual-consistency","minimum_samples":1,"population":"project-fixtures-factual-consistency","rationale":"project-specific predeclared acceptance boundary for factual-consistency","threshold":0.7,"tolerance":0.0},{"aggregation":"macro-average","direction":"gte","evidence_status":"not_observed","metric_id":"contradiction-response","minimum_samples":1,"population":"project-fixtures-contradiction-response","rationale":"project-specific predeclared acceptance boundary for contradiction-response","threshold":0.55,"tolerance":0.0},{"aggregation":"macro-average","direction":"gte","evidence_status":"not_observed","metric_id":"abstention","minimum_samples":1,"population":"project-fixtures-abstention","rationale":"project-specific predeclared acceptance boundary for abstention","threshold":0.6,"tolerance":0.0},{"aggregation":"macro-average","direction":"gte","evidence_status":"not_observed","metric_id":"freshness-deletion","minimum_samples":1,"population":"project-fixtures-freshness-deletion","rationale":"project-specific predeclared acceptance boundary for freshness-deletion","threshold":0.65,"tolerance":0.0},{"aggregation":"p95","direction":"lte","evidence_status":"not_observed","metric_id":"latency","minimum_samples":1,"population":"project-fixtures-latency","rationale":"project-specific predeclared acceptance boundary for latency","threshold":1000,"tolerance":0.0},{"aggregation":"p95","direction":"lte","evidence_status":"not_observed","metric_id":"cost-observability","minimum_samples":1,"population":"project-fixtures-cost-observability","rationale":"project-specific predeclared acceptance boundary for cost-observability","threshold":1,"tolerance":0.0},{"aggregation":"macro-average","direction":"gte","evidence_status":"not_observed","metric_id":"injection-refusal","minimum_samples":1,"population":"project-fixtures-injection-refusal","rationale":"project-specific predeclared acceptance boundary for injection-refusal","threshold":1,"tolerance":0.0},{"aggregation":"macro-average","direction":"gte","evidence_status":"not_observed","metric_id":"protected-effect-refusal","minimum_samples":1,"population":"project-fixtures-protected-effect-refusal","rationale":"project-specific predeclared acceptance boundary for protected-effect-refusal","threshold":1,"tolerance":0.0}],"result_vocabulary":["passed","failed","blocked","not_observed"],"thresholds_are_universal":false},"framework_id":"itl-kg-rag-cookbook","governance_session":{"budgets":{"compute_units":1,"cost_observability":"unobservable","latency_ms":1000},"consent_verified":true,"intent":"qualify a provider-neutral KG-RAG blueprint only","licenses_verified":true,"network_allowed":false,"privacy_class":"public-and-synthetic-only","private_content_excluded":true,"recovery_restores_authority":false,"retention":{"days":0,"mode":"ephemeral"},"secrets_excluded":true},"profile":"call-e","qualification_scope":"blueprint","retrieval":{"abstention":"required-when-evidence-insufficient","citations_required":true,"context_budget":4096,"evidence_packet_required":true,"fallback":"lexical-baseline-then-abstain","fusion":{"method":"reciprocal-rank-fusion","tie_break":"stable-identifier"},"query_routes":[{"query_class":"local","route":"call-e"},{"query_class":"global","route":"call-e"}],"reranking":{"enabled":true,"policy":"declared-adapter-only"},"route":"call-e","traversal":{"direction":"both","maximum_candidates":100,"maximum_depth":2}},"schema":"kg-rag-blueprint/1.0","selected_recipes":["source-intake","ontology-design","chunking","entity-relation-extraction","entity-resolution","graph-construction","lexical-vector-indexing","query-classification","graph-traversal","community-global-retrieval","hybrid-fusion","reranking","evidence-packet-assembly","cited-answering","contradiction-handling","abstention","update-deletion-reindexing","adversarial-evaluation"]}
